Larger Text,Smaller Text,Symbol
WhatHappensinPracticeWhenClipping?,"As you have understood by now, any mapping information is just data. 
 Let’s try to understand what happens to the data when we are executing a 
 clipping operation.
  
 In practice, the clipping operation can have multiple effects, 
  
 depending on the input data. If you are working with raster data, a 
 clipping operation would simply remove the pixels of the raster that are 
 not selected and keep the pixels that are still relevant. The previous 
 schematic drawing shows what would happen with raster data. You can 
 consider that the input data consists of a large number of pixels. In the 
 output, the nonrelevant pixels have been deleted.",NA
ClippinginPython,"In this example, you will see how to apply a clipping operation in Python. 
 The dataset is a dataset that I have generated speciically for this 
  
 exercise. It contains two features:
  
  
  
 A line that covers a part of the Seine River (a famous river in Paris, 
 France, which also covers a large part of the country of France) A 
 polygon that covers the center of Paris",NA
WhatIsIntersecting?,"The second operation that we will be looking at is the intersection. For 
 those of you who are aware of set theory, this part will be relatively 
 straightforward. For those who are not, let’s do an introduction of set 
 theory irst.",NA
WhatHappensinPracticeWhenIntersecting?,"An intersection in set theory takes two input sets and keeps only those 
 items from the set that are present in both. In geodata processing, the 
 same is true. Consider that your sets are now geographical datasets, in 
 which we use the geographical location data as identiier of the objects.
  
 The intersection of two objects will keep all features (columns) of both 
 datasets, but it will keep only those data points that are present in both 
 datasets.
  
 As an example, let’s consider that we again use the Seine River data, 
 and this time we use the main road around Paris (Boulevard 
  
 Périphérique) to identify places at which we should ind bridges or 
 tunnels. This could be useful, for example, if we have no data about 
 bridges and tunnels yet, and we want to automatically identify all 
 locations at which we should ind bridges or tunnels.
  
 The intersection of the two would allow us to keep both the 
  
 information about the road data and the data from the river dataset while 
 reducing the data to the locations where intersections are to be found.
  
  
 Of course, this can be generalized to a large number of problems 
 where the intersection of two datasets is needed.",NA
ConceptualExamplesofIntersectingGeodata,"Let’s now see some examples of how the intersection operation can apply 
 to geodata. Keep in mind that in raster data, there are no items, just pixels, 
 so using set theory is only useful for vector data. You will now see a 
 number of examples of the different vector data types and how an 
  
 intersection would work for them.
  
 Let’s start with considering what happens when intersecting points 
 with points. As a point has no width nor length, only a location, the only 
 intersection that we can do is identify whether points from one dataset 
 overlap with points from the other dataset. If they do, we can consider 
 that these overlapping points are in the intersection. The schematic 
 drawing in Figure 
 5-11
  shows an example of this.",NA
IntersectinginPython,"Let’s now start working on the example that was described earlier in this 
 chapter. We take a dataset with the Boulevard Périphérique and the Seine 
 River, and we use the intersection of those two to identify the locations 
 where the Seine River crosses the Boulevard Périphérique.
  
  
 You can use the code in Code Block 
 5-7
  to import the data and print 
 the dataset.
  
 gpd.io.file.fiona.drvsupport.supported_drivers['KML'] 
 = 'rw' 
  
 data = 
  
 gpd.read_file('ParisSeineData_example2_v2.kml') 
  
 data.head()
  
 CodeBlock5-7
  Import and print the data",NA
DifferenceBetweenClippingandIntersecting,"Now that you have seen both the clipping and the intersection tools, you 
 should understand that both of them generally reduce the quantity of 
 data. There is a fundamental difference between the two, and your choice 
 for the tool should depend on what you intend to accomplish.
  
 Clipping reduces data by taking an input dataset and a boundary 
 dataset. The resulting output data is of the exact shape of the input data, 
 only limited to the geographic extent imposed by the boundary dataset. 
 The only data that is kept is the data of the input layer. You have seen in 
 the clipping example that the Paris polygon was not present in the output: 
 only the Seine River was present, yet in a geographically reduced form.
  
 With intersections, both datasets can be considered as equally 
 important. There is not one input dataset and one boundary dataset, but 
 there are two input datasets. The resulting output is a combination that 
 keeps all the information from both input datasets while still keeping 
 only points that coincide geographically.",NA
KeyTakeaways,"1.
  
 2.
  
 3.
  
 4.
  
 5.
  
 6.
  
 7.
  
 8.
  
 There are numerous basic geodata operations that are standardly 
 implemented in most geodata tools. They may seem simple at irst 
 sight, but applying them to geodata can come with some dificulties.
  
 The clipping operation takes an input dataset and reduces its size to 
 an extent given by a boundary dataset. This can be done for all 
 geodata data types.
  
 Using clipping for raster data or points comes down to deleting the 
 pixel points that are out of scope.
  
 Using clipping for lines or polygons will delete those lines and 
 polygons that are out of scope entirely, but will create a new reduced 
 form for those points that are partly inside and partly outside of the 
 boundaries.
  
 The intersection operation is based on set theory and allows to ind 
 features that are shared between two input datasets. It is different 
 from clipping, as it treats the two datasets as input and therefore 
 keeps the features of both of them. In clipping, this is not the case, as 
 only the features from the input dataset are considered relevant.
  
 Intersecting points basically comes down to iltering points based on 
 their presence in both datasets.
  
 Intersecting lines generally results in points (either crossings 
  
 between two lines or touchpoints between two curving lines), but 
 they can also be lines if two lines are perfectly equal on a part of their 
 trajectory.
  
 Intersecting polygons will result in one or multiple smaller polygons, 
 as the intersection is considered to be the area that the two polygons 
 have in common.",NA
6.Buffers,"Joos Korstanje
 1
  
  
 (1)
  
 VIELS MAISONS, France
  
 In the previous chapter, we have started looking at a number of common 
 geospatial operations: data operations that are not possible, or at least 
 not common, on regular data, but that are very common on geospatial 
 data.
  
 The standard operations that will be covered are
  
  
  
  
  
 Clipping and intersecting 
 Buffering 
  
 Merge and dissolve 
  
 Erase
  
 In the previous chapter, you have already seen two major operations. 
 You have irst seen how to clip data to a speciic extent, mainly for the use 
 of dropping data based on a spatial range. You have also seen how to use 
 intersecting to create data based on applying set theory on geospatial 
 datasets. It was mentioned that other set theory operations can be found 
 in that scope as well.
  
 In this chapter, we will look at a very different geospatial operation. 
 You will discover the geospatial operation of buffering or creating buffers. 
 They are among the standard operations of geospatial operations, and it is 
 useful to master this tool.
  
 Just like intersecting, the buffer is a tool that can be used either as a 
 stand-alone or as a tool for further analysis. It was not mentioned, but in 
 the example of intersections, a buffer operation was used to create 
 polygon data of the bridges and rivers.
  
  
 This clearly shows how those spatial operations should all be seen as 
 tools in a toolkit, and when you want to achieve a speciic goal, you need",NA
WhatAreBuffers?,"Buffers are newly created polygons that surround other existing shapes. 
 The term buffering is adequate, as it really consists of creating a buffer 
 around an existing object.
  
 You can create buffers around all vector data objects, and they always 
 become polygons. For example, this would give the following results 
 based on data type:
  
 – When you create a buffer around a point, you will end up with a new 
  
 buffer polygon that contains the surrounding area around that 
 point.– By adding a buffer to a line, you have a new feature that 
 contains the 
  
 area around that line.
  
 – Buffers around polygons will also contain the area just outside the 
  
 polygon.
  
 Buffers are newly created objects. After computing the buffer polygon, 
 you still have your original data. You will simply have created a new 
 feature which is the buffer.",NA
ASchematicExampleofBuffering,"Let’s clarify this deinition using a more intuitive example. We will take 
 the example that was used in the previous chapter as well, in which we 
 had a line dataset of roads, but we needed to transform those roads into 
 polygons to take into account the width of the road. In the image in 
 Figure 
 6-1
 , you see a road depicted irst as a polygon and then as a line.",NA
WhatHappensinPracticeWhenBuffering?,"Let’s now see some examples of how the intersection operation can apply 
 to geodata. Keep in mind that in raster data, there are no items, just pixels, 
 so using set theory is only useful for vector data. You will now see a 
 number of examples of the different vector data types and how an 
  
 intersection would work for them.",NA
BuffersforPointData,"Let’s start with considering what happens when constructing buffers 
 around points. Points have no width or length, just location. If we create a 
 buffer, we generally make buffers of which the borders are equally far 
 away from the buffered object. Therefore, buffers around points would 
 generally be circles. The chosen size of the buffer would determine the 
 size of those circles. You can see an example in the schematic drawing in 
 Figure 
 6-2
 .",NA
BuffersforLineData,"Let’s now consider the case in which we apply buffers to line data. A irst 
 schematic example was already given before. In that example, a line 
 dataset was present, but it needed to be converted into a polygon to use 
 it for the intersection exercise.
  
 Let’s consider another example. Imagine that you are planning a 
 railroad location somewhere, and you need to investigate the amount of 
 noise problems that you are going to observe and how many people this 
 is going to impact. This is an interesting example, as it advances on the 
 sound pollution problem introduced earlier.",NA
BuffersforPolygonData,NA,NA
CreatingBuffersinPython,"In the coming example, we will be looking at a quite simple but intuitive 
 example of searching a house to rent. Imagine that you have a database 
 with geographic point data that are houses, and you want to do a geodata 
 lookup to test for a number of criteria. In this example, we will go through 
 a number of examples using buffers. You will discover how you can use 
 buffers for your house searching criteria:
  
  
 You will see how to use buffers around points to investigate whether 
 each of the houses is on walking distance to a subway station (a real 
 added value).",NA
CreatingBuffersAroundPointsinPython,"Let’s start by importing the .kml data. Having gone through this 
  
 numerous times in early chapters, this should start to become a habit by 
 now. The code to import the data is shown in Code Block 
 6-1
 .
  
 import geopandas as gpd 
  
 import fiona
  
 # import the paris subway station data 
  
 gpd.io.file.fiona.drvsupport.supported_drivers['KML'] 
 = 'rw' 
  
 data = gpd.read_file('Paris_Metro_Stations.kml') data
  
 CodeBlock6-1
  Import the data 
 The resulting dataframe is shown in Figure 
 6-5
 .",NA
CreatingBuffersAroundLinesinPython,"In this second part of the exercise, you will see how to create a buffer 
 around a line. We will take a line feature that shows the railroad of the 
 subway line, and we will create a buffer that we consider too close to the 
 subway line. Imagine that the subway makes quite some noise. For full 
 disclosure, a large part of the line is actually underground, but let’s leave 
 that out of the equation here, for the purpose of an easier exercise.
  
 Rather than importing a line dataset, let’s use the point dataset from 
 before and convert the eight points into one single line feature. To do so, 
 we irst need to make sure that the points are in the right order, and then 
 we pass them to the LineString function from the shapely package. This is 
 all done in the code in Code Block 
 6-6
 .
  
 from shapely.geometry.linestring import LineString 
 LineString(data.loc[[7,6,5,4,0,1,2,3], 
  
 'geometry'].reset_index(drop=True))
  
 CodeBlock6-6
  A LineString object",NA
CreatingBuffersAroundPolygonsinPython,"The third criterion for the house selection is proximity to a park. In the 
 Paris_Parks.kml dataset, you can ind some parks in Paris. This data is 
 just to serve the example, it is far from perfect, but it will do the trick for 
 this exercise. You can import the data using the code in Code Block 
 6-11
 .
  
 # import the paris parks data 
  
 gpd.io.file.fiona.drvsupport.supported_drivers['KML'] 
 = 'rw' 
  
 parks = gpd.read_file('Paris_Parks.kml') 
  
 parks
  
 CodeBlock6-11
  Importing the parks data 
  
 In Figure 
 6-15
 , you will see that there are 18 parks in this dataset, all 
 identiied as polygons.",NA
CombiningBuffersandSetOperations,NA,NA
KeyTakeaways,"1.
  
 2.
  
 3.
  
 4.
  
 There are numerous basic geodata operations that are standardly 
 implemented in most geodata tools. They may seem simple at irst 
 sight, but applying them to geodata can come with some dificulties.
  
 The buffer operation adds a polygon around a vector object. Whether 
 the initial object is point, line, or polygon, the result is always a 
 polygon.
  
 When applying a buffer, one can choose the distance of the buffer’s 
 boundary to the initial object. The choice depends purely on the use 
 case.
  
 Once buffers are computed, they can be used for mapping purposes, 
 or they can be used in further geospatial operations.",NA
7.MergeandDissolve,"Joos Korstanje
 1
  
  
 (1)
  
 VIELS MAISONS, France
  
 In the previous two chapters, we have started looking at a number of common 
 geospatial operations: data operations that are not possible, or at least not 
 common, on regular data, but that are very common on geospatial data.
  
 Although this book is working toward machine learning applications, it is 
 good to have an understanding of the types of geospatial operations that exist 
 and have a working understanding that will allow you to igure out other, 
 comparable operations using documentation or research. The standard 
 operations that are showcased in this book are
  
  
  
  
  
 Clipping and intersecting 
  
 Buffering 
  
 Merge and dissolve 
  
 Erase
  
 In the previous chapter, you have already seen clipping, intersecting, and 
 buffering. You have even seen a use case that combines those methods in a 
 logical manner.
  
 In this chapter, we will look at merging and dissolving, which are again 
 very different operations than those previously presented. They are also 
 among the standard geospatial operations, and it is useful to master these 
 tools.
  
 As explained in previous chapters, those spatial operations should all be 
 seen as tools in a toolkit, and when you want to achieve a speciic goal, you 
 need to select the different tools that you need to get there. This often means 
 using different combinations of tools in an intelligent manner. The more tools 
 you know, the more you will be able to achieve.
  
 We will start this chapter with the merge operation, covering both theory 
 and implementation in Python, and we will then move on to the dissolve 
 operation. At the end, you will see a comparison of both.",NA
TheMergeOperation,"Let’s begin by introducing the merge operation. We will start with a 
  
 theoretical introduction and some examples and then move on to the Python 
 implementation of the merge operation.
  
 WhatIsaMerge?
  
 Merging geodata, just like with regular data, consists of taking multiple input 
 datasets and making them into a single new output feature. In the previous 
 chapter, you already saw a possible use case for a merge. If you remember, 
 multiple “suitability” polygons were created based on multiple criteria. At the 
 end, all of these polygons were combined into a single spatial layer. Although 
 another solution was used in that example, a merge could have been used to 
 get all those layers together in one and the same layer.
  
 ASchematicExampleofMerging
  
 Let’s clarify this deinition using a visual example. As a simple and intuitive 
 example, imagine that you have three datasets containing some polygon 
 features, each on a speciic region. You are asked to make a map of the three 
 regions combined, and you therefore need to ind a way to put those three 
 datasets together into a single, three-region, dataset. The merge operation 
 will do this for you. Figure 
 7-1
  shows you how this works.",NA
MerginginPython,"In the coming examples, we will be looking at some easy-to-understand data. 
 There are multiple small datasets, and throughout the exercise, we will do all 
 the three types of merges.
  
 The data contains
  
 – A ile with three polygons for Canada, USA, and 
 Mexico– A ile with some cities of Canada
  
 – A ile with some cities of the USA
  
 – A ile with some cities of Mexico
  
 During the exercise, we will take the following steps:
  
 – Combine the three city iles using a row-wise merge
  
 – Add a new variable to the combined city ile using an attribute lookup– 
 Find the country of each of the cities using a spatial lookup with the 
 polygon ile
  
  
 Let’s now start by combining the three city iles into a single layer with all 
 the cities combined.
  
 Row-WiseMerginginPython
  
 The row-wise merge operation is the operation that is generally referred to 
 when talking about the merge operation. It is like a row-wise concatenation of 
 the three datasets. Let’s see how to do this in Python using the three example 
 data iles containing some of the cities of each country. Let’s start by importing 
 the data as follows and plot each of them separately and add a background 
 map, using the functionalities that you have already seen in earlier chapters. 
 This is shown in Code Block 
 7-1
 .
  
 import geopandas as gpd",NA
TheDissolveOperation,"When combining many different datasets, it can often happen that you obtain 
 a lot of overlapping features, like polygons of different granularity being all 
 kept in the data, or the same features being present in each of the dataset and 
 creating doubled information. The dissolve operation is something that can 
 solve such problems.
  
 WhatIstheDissolveOperation?",NA
KeyTakeaways,"1.
  
 2.
  
 3.
  
 There are numerous basic geodata operations that are standardly 
 implemented in most geodata tools. They may seem simple at irst sight, 
 but applying them to geodata can come with some dificulties.
  
 The merge operation is generally used to describe a row-wise merge, in 
 which multiple objects are concatenated into one dataset.
  
 The attribute join, which is confusingly called merge in geopandas, does a 
 column-wise, SQL-like join using a common attribute between the two 
 input datasets.
  
 The spatial join is another column wise join that allows to combine two",NA
8.Erase,"Joos Korstanje
 1
  
  
 (1)
  
 VIELS MAISONS, France
  
 In this chapter, you will learn about the erase operation. The previous 
 three chapters have presented a number of standard GIS operations. 
 Clipping and intersecting were covered in Chapter 
 5
 , buffering in Chapter 
 6
 , and merge and dissolve were covered in Chapter 
 7
 .
  
 This chapter will be the last of those four chapters covering common 
 tools for geospatial analysis. Even though there are much more tools 
 available in the standard GIS toolbox, the goal here is to give you a good 
 mastering of the basics and allowing you to be autonomous in learning 
 the other GIS operations in Python.
  
 The chapter will start with a theoretical introduction of the erase 
 operation and then follow through with a number of example 
  
 implementations in Python for applying the erase on different geodata 
 types.",NA
TheEraseOperation,"Erasing is not just an operation in GIS analysis but also a common 
 synonym for deleting. To clarify, let’s irst look at a “standard” deletion of a 
 feature, which is not a spatial erase, but just a deletion of a complete 
 feature based on its ID rather than based on its spatial information.
  
 Whether you are working with points, lines, or polygons, you could 
 imagine that you simply want to drop one of them. The schematic 
 drawing in Figure 
 8-1
  shows what this would mean.",NA
SchematicOverviewofSpatiallyErasingPoints,"Spatially erasing points is really quite similar to the standard delete 
 operation. When doing a spatial erase, you are going to delete all parts of 
 the input features that coincide spatially with the erase feature. However, 
 as points do not have a size, they will be either entirely inside or entirely 
 outside of the erase feature, which causes each point to be either entirely 
 deleted or retained. The schematic drawing in Figure 
 8-3
  shows how this 
 works.
  
  
 Figure8-3
  Schematic drawing of spatially erasing points. Image by author 
  
 You can see how the data table would change before and after the 
 operation in the schematic drawing in Figure 
 8-4
 .",NA
SchematicOverviewofSpatiallyErasingLines,"Let’s now see how this works when doing a spatial erase on line data. In 
 Figure 
 8-5
 , you see that there are two line features and a polygon erase 
 feature.",NA
SchematicOverviewofSpatiallyErasingPolygons,"The functioning of a spatial erase on polygons is essentially the same as 
 the spatial erase applied to lines. The polygons in the input layer, just like 
 lines, can be altered when they are falling partly inside the erase feature. 
 The schematic drawing in Figure 
 8-7
  shows how this works.",NA
Erasevs.OtherOperations,"As you have already seen in the previous three chapters, there are a large 
 number of spatial operations in standard GIS toolkits. This is great, as it 
 allows you to use the tools that are best suitable for your use case.
  
 However, it is also essential to look into the details of each of the 
 operations to make sure that you are effectively using the right tool for 
 the task that you have at hand.
  
 Let’s now look at a few operations that are relatively comparable to 
 the eraser task. In some cases, you may use another tool for the exact 
 same task. There is no problem in this, as long as you are attentive to the 
 exact implementation and look closely at the documentation of the tools 
 before executing them.",NA
Erasevs.DeletingaFeature,"Deleting an entire feature, also called dropping a feature, or dropping a 
 row in your data, was already mentioned earlier as being relatively 
 similar to the spatial eraser. However, there is an essential difference 
 between the spatial eraser and simply dropping an entire feature.
  
 Dropping a feature will only allow you to drop a feature in its entirety.
  
 The spatial erase can also do this, but the spatial eraser can do more. 
 When a feature in the input layer is entirely covered by the erase feature, 
 the entire input feature will be deleted, but when the feature in the input 
 layer only overlaps partly with the erase feature, there will be an",NA
Erasevs.Clip,"You have seen the clipping operation as the irst GIS tool that was 
 covered. This tool is made for clipping an input layer to a ixed extent, 
 meaning that you delete everything that is outside of your extent. As 
 clipping is also deleting some part of your data, it may be confused with 
 the spatial erase operation. Let’s look at the difference between the two.
  
 The main difference between the clip and the erase operation is that 
 the clip operation will reduce your data to a ixed extent, which can be 
 coordinates or a feature. With a clip, your goal will always be to retain a 
 certain part of the data and delete everything that is outside of your 
 boundaries. In short, you keep inside (where you focus your analysis or 
 map) and remove data that is further away, outside of your boundaries.
  
 The spatial erase does not necessarily take an inside/outside 
 boundaries logic. You can use the eraser also to remove small areas 
 within a general area of interest while keeping the surrounding area.
  
 Whereas both tools are like cookie cutters, the cookie that is cut out is 
 used differently: with the clip operation, you are using the cookie cutter 
 to cut out the cookie that you want to keep, whereas with the erase 
 operation, the cutter is used to cut out parts that you want to throw away. 
 In short, it is a very similar tool for a very different purpose.",NA
