Larger Text,Smaller Text,Symbol
FourTypesofProjectedCoordinateSystems,"As you have understood, there will be a distortion in all Projected 
 Coordinate Systems. As the projections place locations on a three-
 dimensional ball-like form onto a lat two-dimensional rectangle, some 
 features of reality can be maintained as others get lost.
  
 There is no projection better than the other. The question here is 
 rather which types of features you want to maintain and you are 
  
 accepting to lose. There are four categories of Projected Coordinate 
 Systems, all making sure that one aspect of reality is perfectly maintained 
 on the projection.
  
 When choosing a map projection for your project, the key choice is to 
 decide which distortions will be the most appropriate and which features 
 you absolutely want to maintain.
  
 EqualAreaProjections
  
 The irst type of projection is one that preserves the area of speciic 
 features. You may not be aware of it, but many maps that you see do not 
 respect equal area. As an example, if you zoom out a bit on Google Maps, 
 you will see that Greenland is huge in the projection that was chosen by 
 Google Maps.
  
 For some use cases, this can be a big problem. Equal area projections 
 are there to make sure that the surface area of speciic features stays the 
 same (e.g., countries or others). The cost of this is that other features like 
 shapes and angles may become distorted. You may end up with a 
  
 projection in which Greenland respects its real area, but the shape is not 
 perfectly represented as a result.
  
 Example1:MollweideProjection",NA
LocalCoordinateSystems,"As you have seen, there are a number of Geographic Coordinate Systems, 
 followed by an even larger number of map projections that each have 
 their own speciic mathematical deinitions and are each created for a 
 speciic use case or practical and theoretical goals. What they have in",NA
WhichCoordinateSystemtoChoose,"After seeing this large variety and detail of coordinate systems, you may 
 wonder which coordinate systems you should use. And, unfortunately, 
 there is not one clear answer to this. Only if you have very clear needs, 
 whether it is equal distances, equal shapes, or equal areas, there will be a 
 very clear winner. Conic vs. cylindrical maps may also be a clear element 
 of choice in this.
  
 Another part of the answer is that you will very often be “forced” into 
 working with a speciic coordinate system, as you retrieve geodata 
 datasets that are already in a chosen coordinate system. You can always 
 go from one to the other, but if your dataset is large, conversions may 
 take some time and pose problems: staying with a dataset’s coordinate 
 system can be the right choice if you have no speciic needs.
  
 Besides that, it can be a best practice to use “standard” choices. If all 
 maps in your domain of application or in your region use a speciic 
 coordinate system, you may as well go with that choice for increased 
 coherence.
  
 One key takeaway here is that metadata is a crucial part of geodata. 
 Sending datasets with coordinates while failing to mention details on the 
 coordinate system used is very problematic. At the same time, if you are 
 on the receiving end, stay critical of the data you receive, and pay close",NA
PlayingAroundwithSomeMaps,"To end this chapter on coordinate systems, let’s get to some practical 
 applications. You will see how to create some data, change coordinate 
 systems, and show some simple maps in those different coordinate 
 systems. You will see a irst example in which you create your own 
 dataset using Google My Maps. You will project your data into another 
 coordinate system and compare the differences.",NA
Example:WorkingwithOwnData,"In the irst example, you will learn an easy and accessible method for 
 annotating geodata using Google My Maps. You will then import the map 
 in Python and see how to convert it to a different coordinate system.",NA
Step1:MakeYourOwnDatasetonGoogleMyMaps,"Google My Maps is a great starting point for building simple geodatasets. 
 Although it is not much used in professional use cases, it is a great way to 
 get started or to make some quick sketches for smaller projects.
  
 To start building a Google My Maps, you need to go to your Google 
 Drive (drive.google.com). Inside your Google Drive, you click New, and 
 you select New Google My Map. Once you do this, it will automatically 
 open a Google Maps–like page in which you have some additional tools. 
 You will see the toolbars top left.",NA
Step2:AddSomeFeaturesonYourMap,"You can add features on your map by clicking the 
  icon for points and
  
 the 
  icon for lines and polygons. Let’s try to make a polygon that
  
 contains the whole country of France, by clicking around its borders. You 
 should end up with a gray polygon. For copyright reasons, it is not 
 possible to reprint the map in Google format, but you can freely access it 
 over here:
  
 www.google.com/maps/d/edit?
  
 mid=1phChS9aNUukXKk2MwOQyXvksRk-HTOdZ&usp=sharing",NA
Step3:ExportYourMapAsa.KML,"By doing this, you have just created a very simple geodata dataset that 
 contains one polygon. Now, to get this geodata into a different 
  
 environment, let’s export the data.
  
 To do so, you go to the three little dots to the right of the name of your 
 map, and you click Export Map, or Download KML, depending on your 
 version and settings. You can then select to extract 
 onlythelayerrather 
 thantheentiremap
 . This way, you will end up with a dataset that has 
 your own polygon in it. Also, select the option to 
 geta.KMLratherthan 
 a.KMZ
 .",NA
Step4:Importthe.KMLinPython,"Now, let’s see how we can get this map into Python. You can use the 
 geopandas library together with the Fiona library to easily import a .KML 
 map. If you don’t have these libraries installed, you can use Code Block 
 2-
 1
  if you’re in a Jupyter notebook.
  
 !pip install fiona 
  
 !pip install geopandas
  
 CodeBlock2-1
  Installing the libraries 
  
 Then you can use the code in Code Block 
 2-2
  to import your map and 
 show the data that is contained within it.
  
 import fiona 
  
 import geopandas as gpd
  
 gpd.io.file.fiona.drvsupport.supported_drivers['KML'] 
 = 'rw' 
  
 kmlfile = 
  
 gpd.read_file(“the/path/to/the/exported/file.kml"") 
 print(kmlfile)
  
 CodeBlock2-2
  Importing the data 
  
 You’ll ind that there is just one line in this dataframe and that it 
 contains a polygon called France. Figure 
 2-11
  shows this.",NA
Step5:PlottheMap,"Now that you understand how to deine polygon-shaped map data as a 
 text ile, let’s use simple Python functionality to make this into a map. 
 This can be done very easily by using the plot method, as shown in Code 
 Block 
 2-5
 .
  
 import matplotlib.pyplot as plt 
 kmlfile.plot() 
  
 plt.title('Map in WGS 84')
  
 CodeBlock2-5
  Plotting the map 
 The result of this code is shown in Figure 
 2-12
 .",NA
Step6:ChangetheCoordinateSystem,"KML standardly uses the WGS 84 Geographic Coordinate System. You can 
 check that this is the case using the code in Code Block 
 2-6
 .
  
 kmlfile.crs
  
 CodeBlock2-6
  Extracting the coordinate system 
 You’ll see the result like in Figure 
 2-13
  being shown in your notebook.",NA
Step7:PlottheMapAgain,"Now to plot the polygon, the code in Code Block 
 2-8
  will do the job.
  
 proj_kml.plot() 
  
 plt.title('ESRI:102014 map')
  
 CodeBlock2-8
  Plotting the map",NA
KeyTakeaways,"1.
  
  
 Coordinate systems are mathematical descriptions of the earth that 
  
 allow us to communicate about locations precisely 
  
 2.
  
 Many coordinate systems exist, and each has its own advantages and 
 imperfections. One must choose a coordinate system depending on 
 their use case.
  
 3.
  
 Geographic Coordinate Systems use degrees and try to model the 
 Earth as an ellipsoid or sphere.
  
 4.
  
 Projected Coordinate Systems propose methods to convert the 3D 
 reality onto a 2D map. This goes as the cost of some features of 
 reality, which cannot be presented perfectly in 2D.
  
 5. There are a number of well-known projection categories. Equidistant 
  
 makes sure that distances are not disturbed. Equal area projections",NA
3.GeodataDataTypes,"Joos Korstanje
 1
  
  
 (1)
  
 VIELS MAISONS, France
  
 Throughout the previous chapters, you have been (secretly) exposed to a number 
 of different geodata data types. In Chapter 
 1
 , we have talked about identifying 
 points inside a coordinate system. In the previous chapter, you saw how a polygon 
 of the shape of the country France was created. You have also seen examples of a 
 TIFF data ile being imported into Python.
  
 Understanding geodata data types is key in working eficiently with geodata.
  
 In regular, tabular, datasets, it is generally not too costly to transform from one 
 data type to another. Also, it is generally quite easy to say which data type is 
 the“best” data type for a given variable or a given data point.
  
 In geodata, the choice of data types is much more impacting. Transforming 
 polygons of the shapes of countries into points is not a trivial task, as this would 
 require deining (artiicially) where you’d want to put each point. This would be in 
 the “middle,” which would often require quite costly computations.
  
 The other way around, however, would not be possible anymore. Once you 
 have a point dataset with the centers of countries, you would never be able to ind 
 the countries’ exact boundaries anymore.
  
 This problem is illustrated using the two images in Figures 
 3-1
  and 
 3-2
 . You see 
 one that has a map with the contours of the countries of the world, which has some 
 black crosses indicating some of the countries’ center points. In the second 
 example, you see the same map, but with the polygons deleted. You can see clearly 
 that once the polygon information is lost, you cannot go back to this information. 
 This may be acceptable for some use cases, but it may be a problem for many use 
 cases.
  
 In this chapter, you will see the four main types of geodata data types, so that 
 you will be comfortable working with all types, and you will be able to decide on 
 the type of data to use.",NA
Vectorvs.RasterData,"The big split in geodata data types is between vector data and raster data. There 
 is a fundamental difference in how those two are organized.
  
 Vector data is data that contains objects with the speciic coordinates of those 
 objects. Those objects are points, lines, and polygons. In the two images",NA
Points,"The simplest data type is probably the point. You have seen some examples of 
 point data throughout the earlier chapters, and you have seen before that the 
 point is one of the subtypes of vector data.
  
 Points are part of vector data, as each point is an object on the map that has its 
 own coordinates and that can have any number of attributes necessary. Point 
 datasets are great for identifying locations of speciic landmarks or other types of 
 locations. Points cannot store anything like the shape of the size of landmarks, so it 
 is important that you use points only if you do not need such information.",NA
Lines,"Line data is the second category of vector data in the world of geospatial data. 
 They are the logical next step after points. Let’s get into the deinitions straight 
 away.
  
 DeinitionofaLine
  
 Lines are also well-known mathematical objects. In mathematics, we generally 
 consider straight lines that go from one point to a second point. Lines have no 
 width, but they do have a length.
  
 In geodata, line datasets contain not just one line, but many lines. Line segments 
 are straight, and therefore they only need a from point and a to point.",NA
Polygons,"Polygons are the next step in complexity after points and lines. They are the third 
 and last category of vector geodata.
  
 DeinitionofaPolygon
  
 In mathematics, polygons are deined as two-dimensional shapes, made up of 
 lines that connect to make a closed shape. Examples are triangles, rectangles, 
 pentagons, etc. A circle is not oficially a polygon as it is not made up of straight 
 lines, but you could imagine a lot of very small straight lines being able to 
 approximate a circle relatively well.",NA
Rasters/Grids,"Raster data, also called grid data, is the counterpart of vector data. If you’re used 
 to working with digital images in Python, you might ind raster data quite similar. 
 If you’re used to working with dataframes, it may be a bit more abstract, and take 
 a moment to get used to it.
  
 DeinitionofaGridorRaster
  
 A grid, or a raster, is a network of evenly spaced horizontal and vertical lines that 
 cut a space into small squares. In images, we tend to call each of those squares a 
 pixel. In mathematics, there are many other uses for grids, so pixel is not a 
 universal term.
  
 Grid geodata are grids that contain one value per “pixel,” or cell, and therefore 
 they end up being a large number of values illing up a square box. If you are not 
 familiar with this approach, it may seem unlikely that this could be converted into 
 something, but once a color scale is assigned to the values, this is actually how 
 images are made. For raster/grid maps, the same is true.
  
 ImportingaRasterDatasetinPython
  
 On the following website, you can download a GeoTIF ile that contains an 
 interpolated terrain model of Kerbernez in France:
  
 https://geo.data.gouv.fr/en/datasets/b0a420b9e003d45aaf
  
 0670446f0d600df14430cb 
  
 You can use the code in Code Block 
 3-20
  to read and show the raster ile in 
 Python.
  
 import rasterio 
  
 griddata = r'ore-kbz-mnt-litto3d-5m.tif' 
 img = rasterio.open(griddata) 
  
 matrix = img.read() 
  
 matrix
  
 CodeBlock3-20
  Opening the raster data
  
 As you can see in Figure 
 3-21
 , this data looks nothing like a geodataframe 
 whatsoever. Rather, it is just a matrix full of the values of the one (and only one) 
 variable that is contained in this data.",NA
KeyTakeaways,"1.
  
 2.
  
 3.
  
 4.
  
 There are two main categories of geodata: vector and raster. They have 
 fundamentally different ways of storing data.
  
 Vector data stores objects and stores the geospatial references for those 
 objects.
  
 Raster data cuts an area into equal-sized squares and stores a data value for 
 each of those squares.
  
 There are three main types of vector data: point, line, and polygon.
  
 5.
  
 Points are zero-dimensional, and they have no size. They are only indicated 
 by a single x,y coordinate. Points are great for indicating the location of 
 objects.
  
 6.
  
 Lines are one-dimensional. They have a length, but no width. They are 
 indicated by two or more points in a sequence. Lines are great for indicating 
 line-shaped things like rivers and roads.
  
 7. Polygons are two-dimensional objects. They have a shape and size. Polygons are 
 great when your objects are polygons and when you need to retain this 
 information. Polygons can indicate the location of objects if you also need to 
 locate their contour. It can also apply for rivers and roads when you also need 
 to store data about their exact shape and width. Polygons are the data type that 
 can retain the largest amount of information among the three vector data types",NA
4.CreatingMaps,"Joos Korstanje
 1
  
  
 (1)
  
 VIELS MAISONS, France
  
 Mapmaking is one of the earliest and most obvious use cases of the ield of geodata. 
 Maps are a special form of data visualization: they have a lot of standards and are 
 therefore easily recognizable and interpretable for almost anyone.
  
 Just like other data visualization methods, maps are a powerful tool to share a 
 message about a dataset. Visualization tools are often wrongly interpreted as an 
 objective depiction of the truth, whereas in reality, map makers and visualization 
 builders have a huge power of putting things on the map or leaving things out.
  
 An example is color scale picking on maps. People are so familiar with some 
 visualization techniques that when they see them, they automatically believe 
 them.
  
 Imagine a map showing pollution levels in a speciic region. If you would want 
 people to believe that pollution is not a big problem in the area, you could build 
 and share a map that shows areas with low pollution as dark green and very 
 strongly polluted areas as light green. Add to that a small, unreadable, legend, and 
 people will easily interpret that there is no big pollution problem.
  
 If you want to argue the other side, you could publish an alternative map that 
 shows the exact same values, but you depict strong pollution as dark red and 
 slight pollution as light red. When people see this map, they will directly be 
 tempted to conclude that pollution is a huge problem in your area and that it 
 needs immediate action.
  
 It is important to understand that there is no truth in choosing visualization. 
 There are however a number of levers in mapmaking that you should master well 
 in order to create maps for your speciic purpose. Whether your purpose is making 
 objective maps, beautiful maps, or communicating a message, there are a number 
 of tools and best practices that you will discover in this chapter. Those are 
 important to remember when making maps and will come in handy when 
 interpreting maps as well.",NA
MappingUsingGeopandasandMatplotlib,NA,NA
MakingaMapwithCartopy,"We now move on to a second well-known map mapping library in Python called 
 Cartopy. We’ll be walking through one of the simpler examples of Cartopy that is 
 shown in their documentation, in order to get a grasp of the different options, 
 strong points, and weak points of this library.
  
 A strong point of Cartopy is that they have a relatively extensive mapping 
 gallery with maps that you can take and make your own. If you want to check out 
 the examples on their gallery, they can be found on this link:
  
 https://scitools.org.uk/cartopy/docs/latest/gallery/lines_
  
 and_polygons/feature_creation.html#sphx-glr-gallery-lines-
 and-polygons-feature-creation-py
 .
  
 The example that we’ll be looking at irst is based on the example called “lines 
 and polygons feature creation.” It allows you to make a basic land map of a region 
 of the earth.
  
 The code in Code Block 
 4-10
  shows you how this can be done. It goes through a 
 number of steps. The irst important part of the code is to create the
  
 “ig.add_subplot” in which you call a projection argument to solve any problems of 
 coordinate systems right from the start. In this case, the PlateCarree projection is 
 chosen, but the cartopy.crs library has a large number of alternatives.
  
 Secondly, you see that ax.set_extent is called. This will make a subset of the map 
 ranging from the coordinate (-10, 30) in the left-bottom corner to (40, 70) in the 
 top-right corner. You’ll see more details on setting extents in the next chapter.
  
 After this, ax.stock_img() is called to add a background map. It is a simple but 
 recognizable background image with blue seas and brown/green land.
  
 A number of built-in features from Cartopy are also added to the map: Land, 
 Coastline, and the states_provinces that come from Natural Earth Features and 
 are set to a 1:10 million scale.
  
 Finally, a copyright is added to the bottom right.
  
 !pip install cartopy 
  
 import cartopy 
  
 import matplotlib.pyplot as plt 
  
 import cartopy.crs as ccrs 
  
 import cartopy.feature as cfeature 
  
 from matplotlib.offsetbox import AnchoredText",NA
MakingaMapwithPlotly,"It is now time to move to a mapping library that will allow you to make much 
 more aesthetically pleasing visualizations. One library that you can do this with is 
 Plotly. Plotly is a well-known data visualization library in Python, and it has a well-
 developed component for mapping as well.
  
 I strongly recommend checking out the Plotly map gallery (Figure 
 4-11
 ), which 
 is a great resource for getting started with mapmaking. Their plot gallery can be 
 found at 
 https://plotly.com/python/maps/
 , and it contains a large 
 number of code examples of different types of graphs, including
  
 – Choropleth maps
  
 – Bubble maps
  
 – Heat maps
  
 – Scatter plots
  
 – And much more
  
  
 Figure4-11
  Screenshot of the Plotly graph gallery (plotly.com/python/maps)",NA
MakingaMapwithFolium,"In this fourth and inal part on mapmaking with Python, you’ll go another step 
 further in the direction of better aesthetics. Folium is a Python library that 
 integrates with a JavaScript library called Lealet.js.
  
 Folium allows you to create interactive maps, and the results will almost give 
 you the feeling that you are working in Google Maps or comparable software. All 
 this is obtained using a few lines of code, and all the complex work for generating 
 those interactive maps is hidden behind Folium and Lealet.js.
  
 Folium has extensive documentation with loads of examples and quick-start 
 tutorials (
 https://python-",NA
KeyTakeaways,"1.
  
 2.
  
 3.
  
 4.
  
 5.
  
 6.
  
 There are many mapping libraries in Python, each with its speciic advantages 
 and disadvantages.
  
 Using geopandas together with matplotlib is probably the easiest and most 
 intuitive approach to making maps with Python. This approach allows you to 
 work with your dataframes in an intuitive pandas-like manner in geopandas 
 and use the familiar matplotlib plotting syntax. Aesthetically pleasing maps 
 may be a little bit of work to obtain.
  
 Cartopy is an alternative that is less focused on data and more on the actual 
 mapping part. It is a very speciic library to cartography and has good support 
 for different geometries, different coordinate systems, and the like.
  
 Plotly is a visualization library, and it is, therefore, less focused on the 
 geospatial functionalities. It does come with a powerful list of visualization 
 options, and it can create aesthetically pleasing maps that can really 
 communicate a message.
  
 Folium is a great library for creating interactive maps. The maps that you can 
 create even with little code are of high quality and are similar in user 
  
 experience to Google Maps and the like. The built-in background maps allow 
 you to make useful maps even when you have very little data to show.
  
 Having seen those multiple approaches to mapmaking, the most important 
 takeaway is that maps are created for a purpose. They either try to make an 
 objective representation of some data, or they can try to send a message.
  
 They can also be made for having something that is nice to look at. When 
 choosing your method for making maps with Python, you should choose the 
 library and the method that best serves your purpose. This always depends 
 on your use case.",NA
PartII ,NA,NA
GISOperations,NA,NA
5.ClippingandIntersecting,"Joos Korstanje
 1
  
  
 (1)
  
 VIELS MAISONS, France
  
 In the previous four chapters, you have discovered the foundations of 
 working with geodata. In the irst chapter, you have seen what geodata is, 
 how to represent it, and a general overview of tools for using geodata.
  
 After that, Chapter 
 2
  has given you a deeper introduction to coordinate 
 systems and projections, which gives you a framework in which 
  
 coordinates can be used.
  
 Chapter 
 3
  has shown you how to represent geographical data in 
 practice, using one of the geographical data types or shapes. Chapter 
 4 
 has given you an introduction to creating maps.
  
 At this point, you should start having a general idea of geodata and 
 start getting some understanding of what can be done with it, both in a 
 general, theoretical sense and in a practical sense through the Python 
 examples that have been presented.
  
 Now that this introduction is done, the remainder of this book will 
 serve two main objectives. In the coming four chapters, we will focus on 
 four standard operations in geodata processing. The goal here will be to 
 show how to use Python for tasks that are generally already implemented 
 in more speciic GIS tools and systems. When using Python for your GIS 
 work, it is essential that you have these types of standard geodata 
  
 processing tasks in your personal toolkit.
  
 More advanced use cases using machine learning are much less 
 commonly implemented in GIS tools, and their easy availability is what 
 makes Python a great choice as a tool for geodata. These use cases will be 
 covered in the inal chapters of the book.
  
 The standard operations that will be covered are
  
  
 Clipping and intersecting",NA
WhatIsClipping?,"Clipping, in geoprocessing, takes one layer, an input layer, and uses a 
 speciied boundary layer to cut out a part of the input layer. The part that 
 is cut out is retained for future use, and the rest is generally discarded.
  
  
 The clipping operation is like a cookie cutter, in which your cookie 
 dough is the input layer in which a cookie-shaped part is being cut out.",NA
ASchematicExampleofClipping,"Let’s clarify this deinition using a more intuitive example. Imagine that 
 you are working with geodata of a public park. You can get a lot of public 
 data from the Internet, but of course any public data is unlikely to be 
 exactly catered to the size of your park: it will generally be on a much 
 larger scale.
  
 To make working with the data easier, you can use a clipping 
  
 operation to get all the data back to a smaller size and keep only data that 
 is relevant for your park. The schematic drawing in Figure 
 5-1
  shows how 
 this would work.",NA
