Larger Text,Smaller Text,Symbol
MachineLearningonGeographicalData ,NA,NA
UsingPython ,NA,NA
IntroductionintoGeodatawithApplications ,NA,NA
andUseCases,NA,NA
Introduction,"Spatial data has long been an ignored data type in general data science 
 and statistics courses. Yet at the same time, there is a ield of spatial 
 analysis which is strongly developed. Due to differences in tools and 
 approaches, the two ields have long developed in separate 
  
 environments.
  
 With the popularity of data in many business environments, the 
 importance of treating spatial data is also increasing. The goal of the 
 current book is to bridge the gap between data science and spatial 
 analysis by covering tools of both worlds and showing how to use tools 
 from both to answer use cases.
  
 The book starts with a general introduction to geographical data, 
 including data storage formats, data types, common tools and libraries 
 in Python, and the like. Strong attention is paid to the speciicities of 
 spatial data, including coordinate systems and more.
  
 The second part of the book covers a number of methods of the ield 
 of spatial analysis. All of this is done in Python. Even though Python is 
 not the most common tool in spatial analysis, the ecosystem has taken 
 large steps in user-friendliness and has great 
  
 interoperability with machine learning libraries. Python with its rich 
 ecosystem of libraries will be an important tool for spatial analysis in 
 the near future.
  
 The third part of the book covers multiple machine learning use 
 cases on spatial data. In this part of the book, you see that tools from 
 spatial analysis are combined with tools from machine learning and data 
 science to realize more advanced use cases than would be 
  
 possible in many spatial analysis tools. Speciic considerations are 
 needed for applying machine learning to spatial data, due to the 
  
 speciic nature of coordinates and other speciic data formats of spatial 
 data.",NA
SourceCode,"All source code used in the book can be downloaded from
  
 github.com/apress/machine-learning-geographic-
 data-python
 .",NA
TableofContents ,"PartI:GeneralIntroduction 
  
 Chapter1:IntroductiontoGeodata 
  
  
 ReadingGuideforThisBook 
  
  
 GeodataDeinitions 
  
  
  
 CartesianCoordinates 
  
  
  
 PolarCoordinatesandDegrees 
  
  
  
 TheDifferencewithReality 
  
  
 GeographicInformationSystemsandCommonTools 
  
  
 WhatAreGeographicInformationSystems 
  
  
 StandardFormatsofGeodata 
  
  
  
 Shapeile 
  
  
  
 GoogleKMLFile 
  
  
  
 GeoJSON 
  
  
  
 TIFF/JPEG/PNG 
  
  
  
 CSV/TXT/Excel 
  
  
 OverviewofPythonToolsforGeodata 
  
  
 KeyTakeaways 
  
 Chapter2:CoordinateSystemsandProjections 
  
  
 CoordinateSystems 
  
  
  
 GeographicCoordinateSystems 
  
  
  
 ProjectedCoordinateSystems 
  
  
  
 LocalCoordinateSystems 
  
  
 WhichCoordinateSystemtoChoose 
  
  
 PlayingAroundwithSomeMaps 
  
  
  
 Example:WorkingwithOwnData",NA
AbouttheAuthor,"JoosKorstanje 
  
 is a data scientist, with over ive years of 
 industry experience in developing 
  
 machine learning tools. He has a double 
 MSc in Applied Data Science and in 
  
 Environmental Science and has 
  
 extensive experience working with 
  
 geodata use cases. He has worked at a 
 number of large companies in the 
  
 Netherlands and France, developing 
  
 machine learning for a variety of tools. 
 His experience in writing and teaching 
 has motivated him to write this book on 
 machine learning for geodata with 
  
 Python.",NA
AbouttheTechnicalReviewer,"XiaochiLiu
  
 is a PhD researcher and data scientist at 
 Macquarie University, specializing in 
 machine learning, explainable artiicial 
 intelligence, spatial analysis, and their 
 novel application in environmental and 
 public health. He is a programming 
  
 enthusiast using Python and R to 
  
 conduct end-to-end data analysis. His 
 current research applies cutting-edge AI 
 technologies to untangle the causal 
  
 nexus between trace metal 
  
 contamination and human health to
  
  
 develop evidence-based intervention 
  
  
 strategies for mitigating environmental exposure.",NA
PartI ,NA,NA
GeneralIntroduction,NA,NA
1.IntroductiontoGeodata,"Joos Korstanje
 1
  
  
 (1)
  
 VIELS MAISONS, France
  
 Mapmaking and analysis of the geographical environment around us 
 have been present in nature and human society for a long time. Human 
 maps are well known to all of us: they are a great way to share 
  
 information about our environment with others.
  
 Yet communicating geographical instructions is not invented only by 
 the human species. Bees, for example, are well known to communicate on 
 food sources with their fellow hive mates. Bees do not make maps, but, 
 just like us, they use a clearly deined communication system.
  
 As geodata is the topic of this book, I ind it interesting to share this 
 out-of-the-box geodata system used by honeybees. Geodata in the bee 
 world has two components: distance and direction.
  
 Honeybeedistancemetrics
  
 – The round dance: A food source is present less than 50 meters from the 
  
 hive.
  
 – The sickle dance: Food sources are present between 50 and 150 meters 
  
 from the hive.
  
 – The waggle (a.k.a. wag-tail) dance: Food sources are over 150 meters 
 from the hive. In addition, the duration of the waggle dance is an 
 indicator of how far over 150 meters the source is located.
  
 Honeybeedirectionmetrics
  
 – Although more complicated, the angle of the dance is known to be an 
 indicator of the angle relative to the sun that bees must follow to get to 
 their food source.
  
 – As the sun changes location throughout the day, bees will update each 
  
 other by adapting their communication dances accordingly.",NA
ReadingGuideforThisBook,"As you will understand from these two examples, working with geodata is 
 a challenge. While identifying locations of points by coordinates may 
 appear simple, the devil really is in the details.
  
 The goal of this book is to go over all those details while working on 
 example code projects in Python. This should give you the fundamental 
 knowledge needed to start working in the interesting domain of geodata 
 while avoiding mistakes. You will then discover numerous ways to 
 represent geodata and learn to work with tools that make working with 
 geodata easier.
  
 After laying the basis, the book will become more and more advanced 
 by focusing on machine learning techniques for the geodata domain. As 
 you may expect, the speciicities of the use of geodata make that a lot of 
 standards techniques are not applicable at all, or in other cases, they may 
 need speciic adaptations and conigurations.",NA
GeodataDeinitions,"To get started, I want to cover the basics of coordinate systems in the 
 simplest mathematic situation: the Euclidean space. Although the world 
 does not respect the hypothesis made by Euclidean geometry, it is a great 
 entry into the deeper understanding of coordinate systems.",NA
CartesianCoordinates,"To locate points in the Euclidean space, we can use the Cartesian 
  
 coordinate system. This coordinate system speciies each point uniquely 
 by a pair of numerical coordinates. For example, look at the coordinate 
 system in Figure 
 1-2
 , in which two points are located: a square and a 
 triangle.
  
  
 The square is located at x = 2 and y = 1 (horizontal axis). The triangle 
 is located at x = -2 and y = -1.",NA
PolarCoordinatesandDegrees,"A commonly used alternative to Cartesian coordinates is the polar 
 coordinate system. In the polar system, one starts by deining one point as 
 the pole. From this pole starts the polar axis. The graphic in Figure 
 1-3 
 shows the idea.",NA
TheDifferencewithReality,"In reality, you never work with Euclidean space on a map. This is because 
 the world is not lat, but rather a sort of sphere. First of all, it needs to be 
 considered that the object is in three dimensions. More importantly, 
 distances from one point to another need to take into account the speciic 
 curvature of the earth at that point. After all, to make it even more 
 dificult, the earth unfortunately is not a perfectly round ball.
  
 In the real world, things have to be much more complicated than in 
 the Euclidean examples. This is done by the Geographic Coordinate 
 System which is adapted to our ellipsoidal reality. In this system, we 
 usually measure a point by a combination of latitude and longitude.
  
 Latitude indicates how high or low on the globe you are with respect 
 to the equator. Longitude tells us how much left or right on the globe you 
 are with respect to the Greenwich meridian.
  
 The earth is split into four quadrants from the zero point at the 
 intersection of the equator and the Greenwich meridian. You have north 
 and south and east and west together making up four quadrants. The 
 North Pole has a latitude of 90 degrees North, and the South Pole is 90",NA
GeographicInformationSystemsandCommon ,NA,NA
Tools,"As you must understand by now, geodata is an easy way into a headache 
 if you do not have tools that do all the conversion work for you. And we 
 are lucky, as many such tools exist. In this part, let’s have a look at a few 
 of the most commonly used tools together with some advantages and 
 disadvantages of each of them.",NA
WhatAreGeographicInformationSystems,"GIS or Geographic Information Systems are a special type of database 
 system that is made speciically for geographic data, also called geodata. 
 Those database systems are developed in such a way that problems like 
 coordinate systems and more are not a problem to be solved by the user.
  
 It is all done inherently by the system. GIS also stands for the industry 
 that deals with those information systems.",NA
ArcGIS,"ArcGIS, made by ESRI, is arguably the most famous software package for 
 working with Geographic Information Systems. It has a very large 
  
 number of functionalities that can be accessed through a user-friendly 
 click-button system, but visual programming of geodata processing 
 pipelines is also allowed. Python integration is even possible for those who 
 have speciic tasks for which there are no preexisting tools in ArcGIS. 
 Among its tools are also AI and data science options.
  
 ArcGIS is a great software for working with geodata. Yet there is one 
 big disadvantage, and that is that it is a paid, proprietary software. It is 
 therefore accessible only to companies or individuals that have no 
 dificulty paying the considerably high price. Even though it may be worth 
 its price, you’ll need to be able to pay or convince your company to pay 
 for such software. Unfortunately, this is often not the case.",NA
QGISandOtherOpenSourceArcGISAlternatives,"Open source developers have jumped into this open niche of GIS systems 
 by developing open source (and therefore free to use) alternatives. These 
 include QGIS, GRASS GIS, PostGIS, and more.
  
 The clear advantage of this is that they are free to use. Yet their 
 functionality is often much more limited. In most of them, users have the 
 ability to code their own modules in case some of the needed tools are not 
 available.
  
 This approach can be a good it for your need if you are not afraid to 
 commit to a system like QGIS and ill the gaps that you may eventually 
 encounter.",NA
Python/RProgramming,"Finally, you can use Python or R programming for working with geodata 
 as well. Programming, especially in Python or R, is a very common skill 
 among data professionals nowadays.
  
 As programming skills were less well spread a few years back, the 
 boom in data science, machine learning, and artiicial intelligence has 
 made languages like Python become very commonly spread throughout 
 the workforce.
  
 Now that many are able to code or have access to courses to learn 
 how to code, the need for full software becomes less. The availability of a 
 number of well-functioning geodata packages is enough for many to get 
 started.
  
 Python or R programming is a great tool for treating geodata with 
 common or more modern methods. By using these programming 
  
 languages, you can easily apply tools from other libraries to your geodata, 
 without having to convert this to QGIS modules, for example.
  
 The only problem that is not very well solved by programming 
  
 languages is long-term geodata storage. For this, you will need a 
  
 database. Cloud-based databases are nowadays relatively easy to arrange 
 and manage, and this problem is therefore relatively easily solved.",NA
StandardFormatsofGeodata,"As you have understood, there are different tools and programming 
 languages that can easily deal with geodata. While doing geodata in",NA
Shapeile,"The shapeile is a very commonly used ile format for geodata because it is 
 the standard format for ArcGIS. The shapeile is not very friendly for being 
 used outside of ArcGIS, but due to the popularity of ArcGIS, you will likely 
 encounter shapeiles at some point.
  
 The shapeile is not really a single ile. It is actually a collection of iles 
 that are stored together in one and the same directory, all having the 
 same name. You have the following iles that make up a shapeile:
  
 – myile.shp: The main ile, also called the shapeile (confusing but true)– 
 myile.shx: The shapeile index ile
  
 – myile.dbf: The shapeile data ile that stores attribute data
  
 – myile.prj: Optional ile that stores spatial reference and projection 
  
 metadata
  
 As an example, let’s look at an open data dataset containing the 
 municipalities of the Paris region that is provided by the French 
 government. This dataset is freely available at
  
 https://geo.data.gouv.fr/en/datasets/8fadd7040c4b94f
  
 2c318a0971e8faedb7b5675d6 
  
  
 On this website, you can download the data in SHP/L93 format, and 
 this will allow you to download a directory with a zip ile. Figure 
 1-6 
 shows what this contains.
  
  
 Figure1-6
  The inside of the shapeile. Image by author Data source: Ministry of DINSIC. Original 
 data downloaded from  
 https://geo.data.gouv.fr/en/datasets/8fadd7040c4b94f2c318a0971e8faedb7b5675d6
 , updated on 1 
 July 2016. Open Licence 2.0 (
 www.etalab.gouv.fr/wp-content/uploads/2018/11/open-licence.pdf
 )",NA
GoogleKMLFile,"You are probably familiar with Google Earth: one of the dominating map-
 based applications of our time. Google has popularized the KML ile for 
 geodata. It is an XML-based text ile that can contain geometry data.
  
  
 The .KMZ ile is a compressed version of the KML ile. You can 
 decompress it using any unzipping tool and obtain a KML ile.
  
  
 As an example, let’s look at the exact same database as before, which 
 is located at France’s open geodata platform: 
  
  
 Ministry of DINSIC. Original data downloaded from
  
 https://geo.data.gouv.fr/en/datasets/8fadd7040c4b94f 
 2c318a0971e8faedb7b5675d6
 , updated on 1 July 2016. Open Licence 
 2.0 (
 www.etalab.gouv.fr/wp-
  
 content/uploads/2018/11/open-licence.pdf
 ) 
  
  
 In the resources part, you’ll see that this map of the Paris region’s 
 municipalities is also available in the KML format. Download it and you’ll",NA
GeoJSON,NA,NA
TIFF/JPEG/PNG,"Image ile types can also be used to store geodata. After all, many maps 
 are 2D images that lend themselves well to be stored as an image. Some 
 of the standard formats to store images are TIFF, JPEG, and PNG.
  
 – The TIFF format is an uncompressed image. A georeferenced TIFF 
 image is called a GeoTIFF, and it consists of a directory with a TIFF ile 
 and a tfw (world ile).
  
 – The better-known JPEG ile type stores compressed image data. When 
 storing a JPEG in the same folder as a JPW (world ile), it becomes a 
 GeoJPEG.
  
 – The PNG format is another well-known image ile format. You can make 
 this ile into a GeoJPEG as well when using it together with a PWG 
 (world ile).
  
  
 Image ile types are generally used to store raster data. For now, 
 consider that raster data is image-like (one value per pixel), whereas",NA
CSV/TXT/Excel,"The same ile as used in the irst three examples is also available in CSV. 
 When downloading it and opening it with a text viewer, you will observe 
 something like Figure 
 1-16
 .",NA
OverviewofPythonToolsforGeodata,"Here is a list of Python packages that you may want to look into on your 
 journey into geodata with Python:
  
 Geopandas 
  
 General GIS tool with a pandas-like code syntax that makes it very 
 accessible for the data science world.
  
 Fiona 
  
 Reading and writing geospatial data.
  
 Rasterio 
  
 Python package for reading and writing raster data.
  
 GDAL/OGR 
  
 A Python package that can be used for translating between different GIS 
 ile formats.
  
 RSGISLIB 
  
 A package containing remote sensing tools together with raster 
 processing and analysis.
  
 PyProj 
  
 A package that can transform coordinates with multiple geographic 
 reference systems.
  
 Geopy 
  
 Find postal addresses using coordinates or the inverse.
  
 Shapely 
  
 Manipulation of planar geometric objects.
  
 PySAL 
  
 Spatial analysis package in Python.
  
 Scipy.spatial 
  
 Spatial algorithms based on the famous scipy package for data science.",NA
KeyTakeaways,"1.
  
 Cartesian coordinates and polar coordinates are two alternative 
 coordinate systems that can indicate points in a two-dimensional 
 Euclidean space.
  
 2.
  
 The world is an ellipsoid, which makes the two-dimensional 
 Euclidean space a bad representation. Other coordinate systems 
 exist for this real-world scenario.
  
 3.
  
 Geodata is data that contains geospatial references. Geodata can come 
 in many different shapes and sizes. As long as you have 
  
 software implementation (or the skills to build it), you will be able to 
 convert between data formats.
  
 4.
  
 A number of Python packages exist that do a lot of the heavy lifting 
 for you.
  
 5.
  
 The advantage of using Python is that you can have a lot of autonomy 
 on your geodata treatment and that you can beneit from the large 
 number of geodata and other data science and AI packages in the 
 ecosystem.
  
 6. A potential disadvantage of Python is that the software is open 
 source, meaning that you have no guarantee that your preferred 
 libraries still exist in the future. Python is also not suitable for long-
 term data storage and needs to be complemented with such a data 
 storage solution (e g databases or ile storage)",NA
2.CoordinateSystemsandProjections,"Joos Korstanje
 1
  
  
 (1)
  
 VIELS MAISONS, France
  
 In the previous chapter, you have seen an introduction to coordinate 
 systems. You saw an example of how you can use Cartesian coordinates 
 as well as polar coordinates to identify points on a lat, two-dimensional 
 Euclidean space. It was already mentioned at that point that the real-
 world scenario is much more complex.
  
 When you are making maps, you are showing things (objects, images, 
 etc.) that are located on earth. Earth does not respect the rules that were 
 shown in the Euclidean example because Earth is an ellipsoid: a ball form 
 that is not perfectly round. This makes map and coordinate system 
 calculations much more complex than what high-school mathematics 
 teaches us about coordinates.
  
 To make the problem clearer, let’s look at an example of airplane 
 navigation. Airplane lights are a great example to illustrate the problem, 
 as they generally cover long distances. Taking into account the curvature 
 of the earth really doesn’t matter much when measuring the size of your 
 terrace, but it does make a big impact when moving across continents.
  
 Imagine you are lying from Paris to New York using this basic sketch 
 of the world’s geography. You are probably well aware of such an 
  
 organization of the world’s map on a two-dimensional image.
  
 A logical irst impression would be that to go from Madrid to New York 
 in the quickest way, we should follow a line parallel from the latitude 
 lines. Yet (maybe surprisingly at irst) this is 
 not
  the shortest path. An 
 airplane would better curve via the north!
  
 The reason for this is that the more you move to the north, the shorter 
 the latitude lines actually are. Latitude lines go around the earth, so at the 
 North Pole you have a length of zero, and at the equator, the",NA
CoordinateSystems,"While the former discussion was merely intuitive, it is now time to slowly 
 get to more oficial deinitions of the concepts that you have seen. As we are 
 ignoring the height of a point (e.g., with respect to sea level) for the 
 moment, we can identify three types of coordinate systems:
  
 – Geographic Coordinate Systems
  
 – Projected Coordinate Systems
  
 – Local Coordinate Systems
  
 Let’s go over all three of them.",NA
GeographicCoordinateSystems,"Geographic Coordinate Systems are the coordinate systems that we have 
 been talking about in the previous part. They respect the fact that the 
 world is an ellipsoid, and they, therefore, express points using degrees or 
 radians latitude and longitude.
  
  
 As they respect the ellipsoid property of the earth, it is very hard to 
 make maps or plots with such coordinate systems.",NA
LatitudeandLongitude,"In Geographic Coordinate Systems, we speak of latitude and longitude. 
 Generally, the degrees are either expressed together with a mention of 
 North (above the equator) and South (below the equator), East (east from 
 Greenwich meridian), or West (west from Greenwich meridian). 
 East/West and North/South can also be written as negative and positive 
 coordinates. East and North take positive, whereas South and West take 
 negative.
  
 Although this is standard practice, this can change depending on the 
 exact deinition of the Geographic Coordinate System you are using. In 
 theory, anyone could invent a new coordinate system and make it totally 
 different. In practice, there are some standards that everyone is used to, 
 and therefore it is best to use those.",NA
WGS1984GeographicCoordinateSystem,"The WGS 1984, also called WGS 84 or EPSG:4326, is one of the most used 
 Geographic Coordinate Systems. It is also the reference coordinate system 
 of GPS (Global Positioning System) which is used in very many 
 applications. Let’s dive into how the WGS 84 was designed.
  
 The WGS 1984 was designed with the goal to have a coordinate origin 
 located at the center of mass of the Earth. The reference meridian or zero 
 meridian is the IERS Reference Meridian. It is very close to the Greenwich 
 meridian: only 5.3 arc seconds or 102 meters to the east.
  
 There are more speciic deinitions that deine the WGS 84, yet at this 
 point, the information becomes very technical. To quote from the 
  
 Wikipedia page of the WGS 84:
  
 The WGS 84 datum surface is an oblate spheroid with equatorial 
 radius a = 6378137 m at the equator and lattening f = 
  
 1/298.257223563. The reined value of the WGS 84 gravitational",NA
OtherGeographicCoordinateSystems,"As an example, ETRS89 is a coordinate system that is recommended by 
 the European Union for use in geodata in Europe. It is very close to the 
 WGS 84 but has some minor differences that make the ETRS89 not 
 subject to change due to continental drift. As you will understand, 
 continental drift is very slow, and taking things like this into account is 
 partly based on theory rather than practical importance.
  
 Another example is the NAD-83 system, which is used mainly for 
 North America. As the Earth is an imperfect ellipsoid, the makers of this 
 system wanted to take into account how much North America deviates 
 from an ellipsoid to perform better in North America.",NA
ProjectedCoordinateSystems,"When making maps, we need to convert the three-dimensional earth into 
 two-dimensional form. This task is impossible to do perfectly: imagining 
 taking a round plastic soccer ball and cutting it open to make it lat. You 
 will never be able to paste this round ball into a lat rectangle without 
 going through an immense struggle to ind a way to cut the stuff so that it 
 looks more or less coherent.
  
 Luckily, many great minds have come before us to take this challenge 
 and ind great ways to “cut up the ellipsoid earth and paste it on a 
 rectangle.” We call this projecting, as you could imagine that the 3D 
 geographic coordinates get matched with a location on the square. This 
 projects everything in between to its corresponding location.",NA
XandYCoordinates,NA,NA
